{
  "accounting": {
    "currency": null,
    "elapsed_ms": 7.08,
    "executed_tool_calls": 0,
    "external_tokens": 0,
    "human_adjudication_ms": 0,
    "local_compute_ms": null,
    "provider_calls": 0,
    "provider_charge": 0,
    "provider_cost_basis": "NO_PROVIDER_CALLS",
    "provider_wait_ms": 0,
    "usage_source": "LOCAL_FAKE_INSTRUMENTATION"
  },
  "artifact_kind": "DRY_RUN_RECORD",
  "configuration": {
    "accepted_model": "fake-model",
    "configuration_hash": "47bde59317b6f68d1e78848b1145ecdf242e5b467779c2863b39fd13ea356f06",
    "content_hash": "6191b2d6de92c90781618607ec71e61d9dcf2b458f4665a360ca6a5acff3d771",
    "id": "cfg_VKR62E399WEY1J092HF6DAF6M4",
    "model": "fake-model",
    "observed_model": "fake-model",
    "provider": "FAKE",
    "requested_model": "fake-model",
    "runtime_version": "fake-p2-v1",
    "selected_agent_tools": []
  },
  "data_role": "FAKE_INSTRUMENTATION",
  "execution": {
    "completed_at": "2026-09-08T17:20:23.158036+00:00",
    "execution_instance_id": "exe_JQWBXNTWWG8RSH4VF6B7X2DT0R",
    "producer_session_id": "ses_01M210J03JN6HM4S7A4WSRDNAK",
    "started_at": "2026-09-08T17:20:23.154074+00:00",
    "status": "COMPLETED"
  },
  "execution_source": "FAKE_INSTRUMENTATION",
  "input_revision": "56d3de68a31e907753455c6ac403bdf29f02ecb0",
  "limitations": [
    "Fake single-node instrumentation; no hosted or learned-router result.",
    "Zero provider charge means no provider calls; no prices were measured.",
    "Local compute and full production scheduler/feedback integration are not measured."
  ],
  "live_execution_authority": "NOT_AUTHORIZED",
  "measurement_status": "INCONCLUSIVE",
  "pair_id": null,
  "project_lineage": "fake-instrumentation:missing-required-evidence",
  "routing": {
    "decision_kind": "FALLBACK",
    "exploration_enabled": false,
    "mode": "BASELINE_ONLY",
    "node_contract_hash": "a78af7052da2f605a9437d50eb31a8c9b53a59d0a7ed0efd178580adb0b44b9a",
    "promotion_enabled": false,
    "receipt_hash": "7a3cb7c14e00941b13e9efdd6eea383ba64369cc2fe0b935af68b2671d221462",
    "receipt_id": "rcp_VSD4CJJRV919P5ATA9KXBTCYV6",
    "shadow_enabled": false
  },
  "schema_version": "0.1.0",
  "study_id": "ACR-ROUTER-DEV-20260908",
  "task_id": "tsk_01M210J02FA2KWC4GP6F30V4CB",
  "trial_id": "missing-required-evidence",
  "verification": {
    "adjudication_status": "NOT_NEEDED_FAKE",
    "deterministic": true,
    "evidence_hashes": [],
    "execution_instance_id": "exe_JQWBXNTWWG8RSH4VF6B7X2DT0R",
    "independent": true,
    "record_id": "ivr_EQGMGJG0BW16ET4GPQYKN04EH9",
    "required_claim_coverage": 0.0,
    "spec_hash": "582dadb62cf60470f983b7811fae1106b07c66431c0a3e0531c1bb4bc6c45d83",
    "status": "INCONCLUSIVE",
    "verifier_id": "output-contract",
    "verifier_session_id": null,
    "verifier_version": "output-contract-v1"
  }
}
